セット,英語名,日本語名,パワー,タフネス,レアリティ,タイプ,マナコスト,能力
　MagicOrigins,　Liliana DefiantNecromancer,反抗する屍術師、リリアナ（はんこうするしじゅつしりりあな）,　2,3,　神話レア,　〔黒〕プレインズウォーカー,　１黒黒,絆魂あなたがコントロールする他のトークンでないクリーチャーが１体死亡するたび、異端の癒し手、リリアナを追放し、その後、これを変身させた状態でオーナーのコントロール下で戦場に戻す。そうしたなら、黒の2/2のゾンビ(Zombie)・クリーチャー・トークンを１体戦場に出す。[+2]：各プレイヤーはそれぞれカードを１枚捨てる。[-X]：あなたの墓地にある点数で見たマナ・コストがＸの伝説でないクリーチャー・カード１枚を対象とし、それを戦場に戻す。[-8]：あなたは「クリーチャーが１体死亡するたび、次の終了ステップの開始時に、それをあなたのコントロール下で戦場に戻す。」を持つ紋章を得る。　忠誠度：3
　MagicOrigins,　MacabreWaltz,死の円舞曲（しのえんぶきょく）,　2,3,　コモン,　ソーサリー,　１黒,あなたの墓地にあるクリーチャー・カードを最大２枚まで対象とし、それらをあなたの手札に戻す。その後カードを１枚捨てる。
　MagicOrigins,　MalakirCullblade,マラキールの選刃（まらきーるのせんじん）,　1,1,　アンコモン,　クリーチャー,　１黒,対戦相手がコントロールするクリーチャーが１体死亡するたび、マラキールの選刃の上に+1/+1カウンターを１個置く。
　MagicOrigins,　NantukoHusk,ナントゥーコの鞘虫（なんとぅーこのさやむし）,　2,2,　コモン,　クリーチャー,　２黒,クリーチャーを１体、生け贄に捧げる：ナントゥーコの鞘虫は、ターン終了時まで+2/+2の修整を受ける。
　MagicOrigins,　NecromanticSummons,屍術的召喚（しじゅつてきしょうかん）,　2,2,　アンコモン,　ソーサリー,　４黒,墓地にあるクリーチャー・カード１枚を対象とし、それをあなたのコントロール下で戦場に出す。魔巧―あなたの墓地にインスタント・カードやソーサリー・カードが合わせて２枚以上あるなら、そのクリーチャーは+1/+1カウンターが追加で２個置かれた状態で戦場に出る。
　MagicOrigins,　Nightsnare,夜の罠（よるのわな）,　2,2,　コモン,　ソーサリー,　３黒,対戦相手１人を対象とする。そのプレイヤーは自分の手札を公開する。あなたはその中から土地でないカードを１枚選んでもよい。そうしたなら、そのプレイヤーはそのカードを捨てる。そうしなかったなら、そのプレイヤーはカードを２枚捨てる。
　MagicOrigins,　PriestoftheBloodRite,血の儀式の司祭（ちのぎしきのしさい）,　2,2,　レア,　クリーチャー,　３黒黒,血の儀式の司祭が戦場に出たとき、飛行を持つ黒の5/5のデーモン(Demon)・クリーチャー・トークンを１体戦場に出す。あなたのアップキープの開始時に、あなたは２点のライフを失う。
　MagicOrigins,　RabidBloodsucker,狂暴な吸血者（きょうぼうなきゅうけつしゃ）,　3,2,　コモン,　クリーチャー,　４黒,飛行（このクリーチャーは飛行や到達を持たないクリーチャーによってはブロックされない。）狂暴な吸血者が戦場に出たとき、各プレイヤーはそれぞれ２点のライフを失う。
　MagicOrigins,　ReadtheBones,骨読み（ほねよみ）,　3,2,　コモン,　ソーサリー,　２黒,占術２を行い、その後カードを２枚引く。あなたは２点のライフを失う。（占術２を行うには、あなたのライブラリーの一番上から２枚のカードを見て、そのうちの望む枚数のカードを望む順番であなたのライブラリーの一番下に置き、残りを望む順番で一番上に置く。）
　MagicOrigins,　ReaveSoul,魂裂き（たましいさき）,　3,2,　コモン,　ソーサリー,　１黒,パワーが３以下のクリーチャー１体を対象とし、それを破壊する。
　MagicOrigins,　ReturnedCentaur,蘇りしケンタウルス（よみがえりしけんたうるす）,　2,4,　コモン,　クリーチャー,　３黒,蘇りしケンタウルスが戦場に出たとき、プレイヤー１人を対象とする。そのプレイヤーは自分のライブラリーの一番上から４枚のカードを自分の墓地に置く。
　MagicOrigins,　Revenant,黄泉からの帰還者（よみからのきかんしゃ）,　*,*,　アンコモン,　クリーチャー,　４黒,飛行黄泉からの帰還者のパワーとタフネスは、それぞれあなたの墓地にあるクリーチャー・カードの数に等しい。
　MagicOrigins,　ShadowsofthePast,過去の過ち（かこのあやまち）,　*,*,　アンコモン,　エンチャント,　１黒,クリーチャーが１体死亡するたび、占術１を行う。（あなたのライブラリーの一番上のカードを見る。あなたはそのカードをあなたのライブラリーの一番下に置いてもよい。）(４)(黒)：各対戦相手はそれぞれ２点のライフを失い、あなたは２点のライフを得る。この能力は、あなたの墓地にクリーチャー・カードが４枚以上あるときにのみ起動できる。
　MagicOrigins,　ShamblingGhoul,よろめくグール（よろめくぐーる）,　2,3,　コモン,　クリーチャー,　１黒,よろめくグールはタップ状態で戦場に出る。
　MagicOrigins,　TaintedRemedy,穢れた療法（けがれたりょうほう）,　2,3,　レア,　エンチャント,　２黒,対戦相手がライフを得るなら、代わりにそのプレイヤーはその点数に等しいライフを失う。
　MagicOrigins,　ThornbowArcher,茨弓の射手（いばらゆみのしゃしゅ）,　1,2,　コモン,　クリーチャー,　黒,茨弓の射手が攻撃するたび、エルフ(Elf)をコントロールしていない各対戦相手はそれぞれ１点のライフを失う。
　MagicOrigins,　TormentedThoughts,苛まれし思考（さいなまれししこう）,　1,2,　アンコモン,　ソーサリー,　２黒,苛まれし思考を唱えるための追加コストとして、クリーチャーを１体生け贄に捧げる。プレイヤー１人を対象とする。そのプレイヤーは、生け贄に捧げたクリーチャーのパワーに等しい枚数のカードを捨てる。
　MagicOrigins,　TouchofMoonglove,ツキノテブクロの浸潤（つきのてぶくろのしんじゅん）,　1,2,　コモン,　インスタント,　黒,あなたがコントロールするクリーチャー１体を対象とする。ターン終了時まで、それは+1/+0の修整を受けるとともに接死を得る。このターン、そのクリーチャーによってダメージを与えられたクリーチャーが死亡するたび、そのコントローラーは２点のライフを失う。（接死を持つクリーチャーが何らかのダメージをクリーチャーに与えたら、それだけで破壊する。）
　MagicOrigins,　UndeadServant,アンデッドの召使い（あんでっどのめしつかい）,　3,2,　コモン,　クリーチャー,　３黒,アンデッドの召使いが戦場に出たとき、あなたの墓地にある《アンデッドの召使い/UndeadServant》という名前のカード１枚につき、黒の2/2のゾンビ(Zombie)・クリーチャー・トークンを１体戦場に出す。
　MagicOrigins,　UnholyHunger,不浄な飢え（ふじょうなうえ）,　3,2,　コモン,　インスタント,　３黒黒,クリーチャー１体を対象とし、それを破壊する。魔巧―あなたの墓地にインスタント・カードやソーサリー・カードが合わせて２枚以上あるなら、あなたは２点のライフを得る。
　MagicOrigins,　WeightoftheUnderworld,死の国の重み（しのくにのおもみ）,　3,2,　コモン,　エンチャント,　３黒,エンチャント（クリーチャー）エンチャントされているクリーチャーは-3/-2の修整を受ける。
　MagicOrigins,　AbbotofKeralKeep,ケラル砦の修道院長（けらるとりでのしゅうどういんちょう）,　2,1,　レア,　クリーチャー,　１赤,果敢（あなたがクリーチャーでない呪文を１つ唱えるたび、ターン終了時まで、このクリーチャーは+1/+1の修整を受ける。）ケラル砦の修道院長が戦場に出たとき、あなたのライブラリーの一番上のカードを追放する。ターン終了時まで、あなたはそのカードをプレイしてもよい。
　MagicOrigins,　AcolyteoftheInferno,業火の侍祭（ごうかのじさい）,　3,1,　アンコモン,　クリーチャー,　２赤,高名１（このクリーチャーがプレイヤー１人に戦闘ダメージを与えたとき、これが高名でない場合、これの上に+1/+1カウンターを１個置く。これは高名になる。）業火の侍祭がクリーチャー１体にブロックされた状態になるたび、業火の侍祭はそのクリーチャーに２点のダメージを与える。
　MagicOrigins,　ActofTreason,反逆の行動（はんぎゃくのこうどう）,　3,1,　コモン,　ソーサリー,　２赤,クリーチャー１体を対象とする。ターン終了時まで、それのコントロールを得る。そのクリーチャーをアンタップする。それはターン終了時まで速攻を得る。（このターン、それは攻撃したり(Ｔ)したりできる。）
　MagicOrigins,　AkroanSergeant,アクロスの兵長（あくろすのへいちょう）,　2,2,　コモン,　クリーチャー,　２赤,先制攻撃（このクリーチャーは、先制攻撃を持たないクリーチャーより先に戦闘ダメージを与える。）高名１（このクリーチャーがプレイヤー１人に戦闘ダメージを与えたとき、これが高名でない場合、これの上に+1/+1カウンターを１個置く。これは高名になる。）
　MagicOrigins,　AvariciousDragon,強欲なドラゴン（ごうよくなどらごん）,　4,4,　神話レア,　クリーチャー,　２赤赤,飛行あなたのドロー・ステップの開始時に、カードを追加で１枚引く。あなたの終了ステップの開始時に、あなたの手札を捨てる。
　MagicOrigins,　BellowsLizard,ふいごトカゲ（ふいごとかげ）,　1,1,　コモン,　クリーチャー,　赤,(１)(赤)：ふいごトカゲはターン終了時まで+1/+0の修整を受ける。
　MagicOrigins,　BoggartBrute,ボガートの粗暴者（ぼがーとのそぼうしゃ）,　3,2,　コモン,　クリーチャー,　２赤,威迫（このクリーチャーは２体以上のクリーチャーによってしかブロックされない。）
　MagicOrigins,　CalloftheFullMoon,満月の呼び声（まんげつのよびごえ）,　3,2,　アンコモン,　エンチャント,　１赤,エンチャント（クリーチャー）エンチャントされているクリーチャーは+3/+2の修整を受けるとともにトランプルを持つ。（攻撃しているそれは余剰の戦闘ダメージを防御プレイヤーかプレインズウォーカーに与えることができる。）各アップキープの開始時に、直前のターンにプレイヤー１人が２つ以上の呪文を唱えていた場合、満月の呼び声を生け贄に捧げる。
　MagicOrigins,　Chandra RoaringFlame,燃え盛る炎、チャンドラ（もえさかるほのおちゃんどら）,　2,2,　神話レア,　〔赤〕プレインズウォーカー,　１赤赤,あなたが赤の呪文を１つ唱えるたび、カラデシュの火、チャンドラをアンタップする。(Ｔ)：プレイヤー１人を対象とする。カラデシュの火、チャンドラはそのプレイヤーに１点のダメージを与える。このターンにカラデシュの火、チャンドラが３点以上のダメージを与えたなら、カラデシュの火、チャンドラを追放し、その後、これを変身させた状態でオーナーのコントロール下で戦場に戻す。[+1]：プレイヤー１人を対象とする。燃え盛る炎、チャンドラはそのプレイヤーに２点のダメージを与える。[-2]：クリーチャー１体を対象とする。燃え盛る炎、チャンドラはそれに２点のダメージを与える。[-7]：燃え盛る炎、チャンドラは各対戦相手にそれぞれ６点のダメージを与える。これによりダメージを与えられた各プレイヤーはそれぞれ「あなたのアップキープの開始時に、この紋章はあなたに３点のダメージを与える。」を持つ紋章を得る。　忠誠度：4
　MagicOrigins,　Chandra'sFury,チャンドラの憤怒（ちゃんどらのふんぬ）,　2,2,　コモン,　インスタント,　４赤,プレイヤー１人を対象とする。チャンドラの憤怒はそのプレイヤーに４点のダメージと、そのプレイヤーがコントロールする各クリーチャーにそれぞれ１点のダメージを与える。
　MagicOrigins,　Chandra'sIgnition,チャンドラの灯の目覚め（ちゃんどらのひのめざめ）,　2,2,　レア,　ソーサリー,　３赤赤,あなたがコントロールするクリーチャー１体を対象とする。それは他の各クリーチャーと各対戦相手に、自身のパワーに等しい点数のダメージをそれぞれ与える。
　MagicOrigins,　Cobblebrute,暴れ玉石（あばれたまいし）,　5,2,　コモン,　クリーチャー,　３赤,
　MagicOrigins,　Demolish,破砕（はさい）,　5,2,　コモン,　ソーサリー,　３赤,アーティファクト１つか土地１つを対象とし、それを破壊する。
　MagicOrigins,　DragonFodder,ドラゴンの餌（どらごんのえさ）,　5,2,　コモン,　ソーサリー,　１赤,赤の1/1のゴブリン(Goblin)・クリーチャー・トークンを２体戦場に出す。
　MagicOrigins,　EmbermawHellion,燃えさし口のヘリオン（もえさしぐちのへりおん）,　4,5,　レア,　クリーチャー,　３赤赤,トランプル（攻撃しているこのクリーチャーは余剰の戦闘ダメージを防御プレイヤーかプレインズウォーカーに与えることができる。）あなたがコントロールする他の赤の発生源がパーマネントかプレイヤーにダメージを与えるなら、代わりにそれはそのパーマネントやプレイヤーに、その点数に１を足した点数のダメージを与える。
　MagicOrigins,　EnthrallingVictor,心酔させる勝者（しんすいさせるしょうしゃ）,　3,2,　アンコモン,　クリーチャー,　３赤,心酔させる勝者が戦場に出たとき、対戦相手がコントロールするパワーが２以下のクリーチャー１体を対象とし、ターン終了時まで、それのコントロールを得る。そのクリーチャーをアンタップする。ターン終了時まで、それは速攻を得る。（このターン、それは攻撃したり(Ｔ)したりできる。）
　MagicOrigins,　ExquisiteFirecraft,極上の炎技（ごくじょうのえんぎ）,　3,2,　レア,　ソーサリー,　１赤赤,クリーチャー１体かプレイヤー１人を対象とする。極上の炎技はそれに４点のダメージを与える。魔巧―あなたの墓地にインスタント・カードやソーサリー・カードが合わせて２枚以上あるなら、極上の炎技は呪文や能力によっては打ち消されない。
　MagicOrigins,　FieryConclusion,焦熱の結末（しょうねつのけつまつ）,　3,2,　アンコモン,　インスタント,　１赤,焦熱の結末を唱えるための追加コストとして、クリーチャーを１体生け贄に捧げる。クリーチャー１体を対象とする。焦熱の結末はそれに５点のダメージを与える。
　MagicOrigins,　FieryImpulse,焦熱の衝動（しょうねつのしょうどう）,　3,2,　コモン,　インスタント,　赤,クリーチャー１体を対象とする。焦熱の衝動はそれに２点のダメージを与える。魔巧―あなたの墓地にインスタント・カードやソーサリー・カードが合わせて２枚以上あるなら、焦熱の衝動はそのクリーチャーに２点の代わりに３点のダメージを与える。
　MagicOrigins,　FirefiendElemental,炎魔の精霊（えんまのせいれい）,　3,2,　コモン,　クリーチャー,　３赤,速攻（このクリーチャーは、あなたのコントロール下になってすぐに攻撃したり(Ｔ)したりできる。）高名１（このクリーチャーがプレイヤー１人に戦闘ダメージを与えたとき、これが高名でない場合、これの上に+1/+1カウンターを１個置く。これは高名になる。）
　MagicOrigins,　FlameshadowConjuring,炎影の妖術（えんえいのようじゅつ）,　3,2,　レア,　エンチャント,　３赤,トークンでないクリーチャーが１体あなたのコントロール下で戦場に出るたび、あなたは(赤)を支払ってもよい。そうしたなら、あなたはそのクリーチャーのコピーであるトークンを１体戦場に出す。そのトークンは速攻を得る。次の終了ステップの開始時に、それを追放する。
　MagicOrigins,　GhirapurAEtherGrid,ギラプールの霊気格子（ぎらぷーるのれいきごうし）,　3,2,　アンコモン,　エンチャント,　２赤,あなたがコントロールするアンタップ状態のアーティファクトを２つタップする：クリーチャー１体かプレイヤー１人を対象とする。ギラプールの霊気格子はそれに１点のダメージを与える。
　MagicOrigins,　GhirapurGearcrafter,ギラプールの歯車造り（ぎらぷーるのはぐるまづくり）,　2,1,　コモン,　クリーチャー,　２赤,ギラプールの歯車造りが戦場に出たとき、飛行を持つ無色の1/1の飛行機械(Thopter)アーティファクト・クリーチャー・トークンを１体戦場に出す。（飛行を持つクリーチャーは、飛行や到達を持たないクリーチャーによってはブロックされない。）
　MagicOrigins,　GoblinGloryChaser,ゴブリンの栄光追い（ごぶりんのえいこうおい）,　1,1,　アンコモン,　クリーチャー,　赤,高名１（このクリーチャーがプレイヤー１人に戦闘ダメージを与えたとき、これが高名でない場合、これの上に+1/+1カウンターを１個置く。これは高名になる。）ゴブリンの栄光追いが高名であるかぎり、これは威迫を持つ。（これは２体以上のクリーチャーによってしかブロックされない。）
　MagicOrigins,　GoblinPiledriver,ゴブリンの群衆追い（ごぶりんのぐんしゅうおい）,　1,2,　レア,　クリーチャー,　１赤,プロテクション（青）（このクリーチャーは青のものに対して、ブロックされず、対象にならず、ダメージを与えられず、エンチャントされない。）ゴブリンの群衆追いが攻撃するたび、それはターン終了時まで他の攻撃しているゴブリン(Goblin)１体につき+2/+0の修整を受ける。
　MagicOrigins,　InfectiousBloodlust,伝染性渇血症（でんせんせいかっけつしょう）,　1,2,　コモン,　エンチャント,　１赤,エンチャント（クリーチャー）エンチャントされているクリーチャーは+2/+1の修整を受けるとともに速攻を持つ。毎ターン、それは可能なら攻撃する。エンチャントされているクリーチャーが死亡したとき、あなたはあなたのライブラリーから《伝染性渇血症/InfectiousBloodlust》という名前のカードを１枚探してもよい。そうしたなら、それを公開してあなたの手札に加え、その後あなたのライブラリーを切り直す。
　MagicOrigins,　LightningJavelin,稲妻の投槍（いなずまのなげやり）,　1,2,　コモン,　ソーサリー,　３赤,クリーチャー１体かプレイヤー１人を対象とする。稲妻の投槍はそれに３点のダメージを与える。占術１を行う。（あなたのライブラリーの一番上のカードを見る。あなたはそのカードをあなたのライブラリーの一番下に置いてもよい。）
　MagicOrigins,　Mage-RingBully,魔道士輪の暴漢（まどうしりんのぼうかん）,　2,2,　コモン,　クリーチャー,　１赤,果敢（あなたがクリーチャーでない呪文を１つ唱えるたび、ターン終了時まで、このクリーチャーは+1/+1の修整を受ける。）毎ターン、魔道士輪の暴漢は可能なら攻撃する。
　MagicOrigins,　MagmaticInsight,マグマの洞察力（まぐまのどうさつりょく）,　2,2,　アンコモン,　ソーサリー,　赤,マグマの洞察力を唱えるための追加コストとして、土地カードを１枚捨てる。カードを２枚引く。
　MagicOrigins,　MoltenVortex,溶鉄の渦（ようてつのうず）,　2,2,　レア,　エンチャント,　赤,(赤) 土地カードを１枚捨てる：クリーチャー１体かプレイヤー１人を対象とする。溶鉄の渦はそれに２点のダメージを与える。
　MagicOrigins,　PiaandKiranNalaar,ピア・ナラーとキラン・ナラー（ぴあならーときらんならー）,　2,2,　レア,　伝説のクリーチャー,　２赤赤,ピア・ナラーとキラン・ナラーが戦場に出たとき、飛行を持つ無色の1/1の飛行機械(Thopter)アーティファクト・クリーチャー・トークンを２体戦場に出す。(２)(赤) アーティファクトを１つ生け贄に捧げる：クリーチャー１体かプレイヤー１人を対象とする。ピア・ナラーとキラン・ナラーはそれに２点のダメージを与える。
　MagicOrigins,　Prickleboar,トゲイノシシ（とげいのしし）,　3,3,　コモン,　クリーチャー,　４赤,あなたのターンであるかぎり、トゲイノシシは+2/+0の修整を受けるとともに先制攻撃を持つ。（これは先制攻撃を持たないクリーチャーより先に戦闘ダメージを与える。）
　MagicOrigins,　RavagingBlaze,残虐無道の猛火（ざんぎゃくむどうのもうか）,　3,3,　アンコモン,　インスタント,　Ｘ赤赤,クリーチャー１体を対象とする。残虐無道の猛火はそれにＸ点のダメージを与える。魔巧―あなたの墓地にインスタント・カードやソーサリー・カードが合わせて２枚以上あるなら、残虐無道の猛火はそのクリーチャーのコントローラーにもＸ点のダメージを与える。
　MagicOrigins,　Scab-ClanBerserker,瘡蓋族の狂戦士（かさぶたぞくのきょうせんし）,　2,2,　レア,　クリーチャー,　１赤赤,速攻高名１（このクリーチャーがプレイヤー１人に戦闘ダメージを与えたとき、これが高名でない場合、これの上に+1/+1カウンターを１個置く。これは高名になる。）対戦相手がクリーチャーでない呪文を１つ唱えるたび、瘡蓋族の狂戦士が高名である場合、瘡蓋族の狂戦士はそのプレイヤーに２点のダメージを与える。
　MagicOrigins,　SeismicElemental,地震の精霊（じしんのせいれい）,　4,4,　アンコモン,　クリーチャー,　３赤赤,地震の精霊が戦場に出たとき、このターン、飛行を持たないクリーチャーではブロックできない。
　MagicOrigins,　SkyrakerGiant,空荒らしの巨人（そらあらしのきょじん）,　4,3,　アンコモン,　クリーチャー,　２赤赤,到達（このクリーチャーは飛行を持つクリーチャーをブロックできる。）
　MagicOrigins,　SmashtoSmithereens,粉々（こなごな）,　4,3,　コモン,　インスタント,　１赤,アーティファクト１つを対象とし、それを破壊する。粉々は、そのアーティファクトのコントローラーに３点のダメージを与える。
　MagicOrigins,　SubterraneanScout,地底の斥候（ちていのせっこう）,　2,1,　コモン,　クリーチャー,　１赤,地底の斥候が戦場に出たとき、パワーが２以下のクリーチャー１体を対象とする。このターン、それはブロックされない。
